{
  "audit_id": "a1b2c3d4-1111-4aaa-bbbb-000000000001",
  "access_class": "registered",
  "project_id": "a1b2c3d4-1111-4aaa-bbbb-000000000099",
  "site_id": "a1b2c3d4-1111-4aaa-bbbb-000000000098",
  "owner_user_id": "a1b2c3d4-1111-4aaa-bbbb-000000000097",
  "mode": "single_page",
  "target_url": "https://example.com/",
  "status": "READY_COMPLETE",
  "methodology_version": "0.1.0-draft",
  "noindex": false,
  "created_at": "2026-10-01T10:00:00Z",
  "updated_at": "2026-10-01T10:05:00Z",
  "completed_at": "2026-10-01T10:05:00Z"
}
