{
  "audit_id": "b2b2b2b2-2222-4bbb-aaaa-000000000001",
  "access_class": "registered",
  "project_id": "b2b2b2b2-2222-4bbb-aaaa-000000000099",
  "site_id": "b2b2b2b2-2222-4bbb-aaaa-000000000098",
  "owner_user_id": "b2b2b2b2-2222-4bbb-aaaa-000000000097",
  "mode": "single_page",
  "target_url": "http://169.254.169.254/latest/meta-data/",
  "status": "QUEUED",
  "methodology_version": "0.1.0-draft",
  "noindex": false,
  "created_at": "2026-10-01T10:00:00Z",
  "updated_at": "2026-10-01T10:00:00Z"
}
